{
  "$schema": "https://json-schema.org/draft/2020-12/schema",
  "$id": "qualification-evidence-decision-receipt.schema.json",
  "title": "OpenAdapt qualification evidence decision receipt v2",
  "type": "object",
  "additionalProperties": false,
  "required": [
    "schema_version",
    "evidence_class",
    "decision_identity_sha256",
    "decision_revision",
    "decision_commitment_sha256",
    "evidence_manifest_sha256",
    "evidence_manifest_readback_sha256",
    "organization_id_sha256",
    "workflow_id_sha256",
    "workflow_version_id_sha256",
    "bundle_version",
    "bundle_sha256",
    "admitted_runtime_sha256",
    "application_contract_sha256",
    "environment_contract_sha256",
    "input_contract_sha256",
    "action_contract_sha256",
    "identity_contract_sha256",
    "effect_contract_sha256",
    "policy_contract_sha256",
    "evidence_authority_contract_sha256",
    "campaign_permit_sha256",
    "signer_registry_sha256",
    "revocation_state_sha256",
    "entity_class",
    "campaign_summary",
    "verdict",
    "issued_at",
    "not_before",
    "expires_at",
    "issuer_key_id",
    "algorithm",
    "signing_statement",
    "signature",
    "campaign_artifact_sha256",
    "issuer"
  ],
  "properties": {
    "schema_version": {"const": "openadapt.qualification-evidence-decision-receipt/v2"},
    "evidence_class": {"enum": ["private-customer", "remote-safe-synthetic"]},
    "decision_identity_sha256": {"$ref": "#/$defs/digest"},
    "decision_revision": {"type": "integer", "minimum": 1},
    "decision_commitment_sha256": {"$ref": "#/$defs/digest"},
    "evidence_manifest_sha256": {"$ref": "#/$defs/digest"},
    "evidence_manifest_readback_sha256": {"$ref": "#/$defs/digest"},
    "organization_id_sha256": {"$ref": "#/$defs/digest"},
    "workflow_id_sha256": {"$ref": "#/$defs/digest"},
    "workflow_version_id_sha256": {"$ref": "#/$defs/digest"},
    "bundle_version": {
      "type": "string",
      "minLength": 5,
      "maxLength": 64,
      "pattern": "^(0|[1-9][0-9]{0,9})\\.(0|[1-9][0-9]{0,9})\\.(0|[1-9][0-9]{0,9})(-[0-9A-Za-z]+([.-][0-9A-Za-z]+)*)?$"
    },
    "bundle_sha256": {"$ref": "#/$defs/digest"},
    "admitted_runtime_sha256": {"$ref": "#/$defs/digest"},
    "application_contract_sha256": {"$ref": "#/$defs/digest"},
    "environment_contract_sha256": {"$ref": "#/$defs/digest"},
    "input_contract_sha256": {"$ref": "#/$defs/digest"},
    "action_contract_sha256": {"$ref": "#/$defs/digest"},
    "identity_contract_sha256": {"$ref": "#/$defs/digest"},
    "effect_contract_sha256": {"$ref": "#/$defs/digest"},
    "policy_contract_sha256": {"$ref": "#/$defs/digest"},
    "evidence_authority_contract_sha256": {"$ref": "#/$defs/digest"},
    "campaign_permit_sha256": {"$ref": "#/$defs/digest"},
    "signer_registry_sha256": {"$ref": "#/$defs/digest"},
    "revocation_state_sha256": {"$ref": "#/$defs/digest"},
    "entity_class": {"type": "string", "pattern": "^[a-z][a-z0-9 -]{0,63}$"},
    "campaign_summary": {"$ref": "#/$defs/campaign_summary"},
    "verdict": {"const": "ADMIT"},
    "issued_at": {"$ref": "#/$defs/timestamp"},
    "not_before": {"$ref": "#/$defs/timestamp"},
    "expires_at": {"oneOf": [{"$ref": "#/$defs/timestamp"}, {"type": "null"}]},
    "issuer_key_id": {"type": "string", "pattern": "^qa-ed25519-[0-9a-f]{16}$"},
    "algorithm": {"const": "ed25519"},
    "signing_statement": {"$ref": "#/$defs/signing_statement"},
    "signature": {"type": "string", "pattern": "^[A-Za-z0-9+/]{86}==$"},
    "campaign_artifact_sha256": {"$ref": "#/$defs/digest"},
    "issuer": {
      "oneOf": [
        {"$ref": "#/$defs/private_issuer"},
        {"$ref": "#/$defs/synthetic_issuer"}
      ]
    }
  },
  "allOf": [
    {
      "if": {"properties": {"evidence_class": {"const": "remote-safe-synthetic"}}},
      "then": {"properties": {"issuer": {"$ref": "#/$defs/synthetic_issuer"}}},
      "else": {"properties": {"issuer": {"$ref": "#/$defs/private_issuer"}}}
    }
  ],
  "$defs": {
    "digest": {"type": "string", "pattern": "^sha256:[0-9a-f]{64}$"},
    "commit": {"type": "string", "pattern": "^[0-9a-f]{40}$"},
    "timestamp": {"type": "string", "format": "date-time", "pattern": "^[0-9]{4}-[0-9]{2}-[0-9]{2}T[0-9]{2}:[0-9]{2}:[0-9]{2}Z$"},
    "signing_statement": {
      "type": "object",
      "additionalProperties": false,
      "required": [
        "schema_version", "object_schema_version", "signature_domain",
        "unsigned_object_sha256", "unsigned_size_bytes", "commitment_scheme"
      ],
      "properties": {
        "schema_version": {
          "const": "openadapt.qualification-evidence-signing-statement/v1"
        },
        "object_schema_version": {
          "const": "openadapt.qualification-evidence-decision-receipt/v2"
        },
        "signature_domain": {
          "const": "OpenAdapt qualification evidence decision receipt v2\u0000"
        },
        "unsigned_object_sha256": {"$ref": "#/$defs/digest"},
        "unsigned_size_bytes": {"type": "integer", "minimum": 1},
        "commitment_scheme": {"const": "sha256-canonical-json-lf"}
      }
    },
    "private_issuer": {
      "type": "object",
      "additionalProperties": false,
      "required": ["repository", "repository_id", "repository_owner_id", "workflow", "ref", "source_commit", "environment"],
      "properties": {
        "repository": {"const": "OpenAdaptAI/openadapt-internal"},
        "repository_id": {"const": "1170060695"},
        "repository_owner_id": {"const": "132681217"},
        "workflow": {"const": ".github/workflows/issue-private-qualification-evidence-decision.yml"},
        "ref": {"const": "refs/heads/main"},
        "source_commit": {"$ref": "#/$defs/commit"},
        "environment": {"const": "private-qualification-evidence-decision"}
      }
    },
    "synthetic_issuer": {
      "type": "object",
      "additionalProperties": false,
      "required": ["repository", "repository_id", "repository_owner_id", "workflow", "ref", "source_commit", "environment"],
      "properties": {
        "repository": {"const": "OpenAdaptAI/.github"},
        "repository_id": {"const": "858454062"},
        "repository_owner_id": {"const": "132681217"},
        "workflow": {"const": ".github/workflows/issue-synthetic-qualification-evidence-decision.yml"},
        "ref": {"const": "refs/heads/main"},
        "source_commit": {"$ref": "#/$defs/commit"},
        "environment": {"const": "synthetic-qualification-evidence-decision"}
      }
    },
    "campaign_counts": {
      "type": "object",
      "additionalProperties": false,
      "required": [
        "task_condition_cell_count",
        "minimum_trials_per_cell",
        "observed_trial_count",
        "silent_incorrect_success_count",
        "over_halt_count",
        "unsafe_effect_count",
        "blind_retry_count",
        "replay_dispatch_count",
        "model_call_count",
        "unplanned_intervention_count",
        "reconciliation_required_count",
        "authenticated_bound_decision_count",
        "live_target_revalidation_count",
        "policy_approved_repair_count",
        "approved_repair_count",
        "retained_repair_evidence_count",
        "unverified_direct_action_count"
      ],
      "properties": {
        "task_condition_cell_count": {"type": "integer", "minimum": 1},
        "minimum_trials_per_cell": {"type": "integer", "minimum": 3},
        "observed_trial_count": {"type": "integer", "minimum": 3},
        "silent_incorrect_success_count": {"type": "integer", "minimum": 0},
        "over_halt_count": {"type": "integer", "minimum": 0},
        "unsafe_effect_count": {"type": "integer", "minimum": 0},
        "blind_retry_count": {"type": "integer", "minimum": 0},
        "replay_dispatch_count": {"type": "integer", "minimum": 0},
        "model_call_count": {"type": "integer", "minimum": 0},
        "unplanned_intervention_count": {"type": "integer", "minimum": 0},
        "reconciliation_required_count": {"type": "integer", "minimum": 0},
        "authenticated_bound_decision_count": {"type": "integer", "minimum": 0},
        "live_target_revalidation_count": {"type": "integer", "minimum": 0},
        "policy_approved_repair_count": {"type": "integer", "minimum": 0},
        "approved_repair_count": {"type": "integer", "minimum": 0},
        "retained_repair_evidence_count": {"type": "integer", "minimum": 0},
        "unverified_direct_action_count": {"type": "integer", "minimum": 0}
      }
    },
    "campaign_classes": {
      "type": "object",
      "additionalProperties": false,
      "required": ["healthy", "safe_halt", "idempotency_replay", "uncertain_delivery", "declared_attended", "governed_repair"],
      "properties": {
        "healthy": {"$ref": "#/$defs/campaign_counts"},
        "safe_halt": {"$ref": "#/$defs/campaign_counts"},
        "idempotency_replay": {"$ref": "#/$defs/campaign_counts"},
        "uncertain_delivery": {"$ref": "#/$defs/campaign_counts"},
        "declared_attended": {"$ref": "#/$defs/campaign_counts"},
        "governed_repair": {"$ref": "#/$defs/campaign_counts"}
      }
    },
    "campaign_summary": {
      "type": "object",
      "additionalProperties": false,
      "required": [
        "schema_version",
        "minimum_trials_per_task_condition",
        "task_count",
        "classes"
      ],
      "properties": {
        "schema_version": {
          "const": "openadapt.qualification-evidence-decision-campaign-summary/v1"
        },
        "minimum_trials_per_task_condition": {"const": 3},
        "task_count": {"type": "integer", "minimum": 1},
        "classes": {"$ref": "#/$defs/campaign_classes"}
      }
    }
  }
}
