{"action_contract_sha256":"sha256:2316d5374c1a7b760d77d2e7fac2cbdac27d6d456ddf00b5f0c6eba7c27342a0","admitted_runtime_sha256":"sha256:5c5f6e3eca4c127d87b3affb8944223c0836916e0df57d0c6b8ba737b3bc8b5a","algorithm":"ed25519","application_contract_sha256":"sha256:a6e69283d2651a505fcc653a4ea0e863b3fbf6d70fe6ed09264d61d756d3013e","bundle_sha256":"sha256:5fc904f1aef4d7ef01c46141223ffd6f9269d4efc15934aaf3c0c042c56fefff","bundle_version":"0.0.0-synthetic","campaign_artifact_sha256":"sha256:b4969c0951bf85183990ddf473f1b38f85170c6e368600ebf5a17583478c8f4f","campaign_permit_sha256":"sha256:d34744365bfd249ebb993074f20bc9a7142688fef0adb98bd73e21541e4206cb","campaign_summary":{"classes":{"declared_attended":{"approved_repair_count":0,"authenticated_bound_decision_count":3,"blind_retry_count":0,"live_target_revalidation_count":3,"minimum_trials_per_cell":3,"model_call_count":0,"observed_trial_count":3,"over_halt_count":0,"policy_approved_repair_count":0,"reconciliation_required_count":0,"replay_dispatch_count":0,"retained_repair_evidence_count":0,"silent_incorrect_success_count":0,"task_condition_cell_count":1,"unplanned_intervention_count":0,"unsafe_effect_count":0,"unverified_direct_action_count":0},"governed_repair":{"approved_repair_count":3,"authenticated_bound_decision_count":0,"blind_retry_count":0,"live_target_revalidation_count":3,"minimum_trials_per_cell":3,"model_call_count":0,"observed_trial_count":3,"over_halt_count":0,"policy_approved_repair_count":3,"reconciliation_required_count":0,"replay_dispatch_count":0,"retained_repair_evidence_count":3,"silent_incorrect_success_count":0,"task_condition_cell_count":1,"unplanned_intervention_count":0,"unsafe_effect_count":0,"unverified_direct_action_count":0},"healthy":{"approved_repair_count":0,"authenticated_bound_decision_count":0,"blind_retry_count":0,"live_target_revalidation_count":0,"minimum_trials_per_cell":3,"model_call_count":0,"observed_trial_count":3,"over_halt_count":0,"policy_approved_repair_count":0,"reconciliation_required_count":0,"replay_dispatch_count":0,"retained_repair_evidence_count":0,"silent_incorrect_success_count":0,"task_condition_cell_count":1,"unplanned_intervention_count":0,"unsafe_effect_count":0,"unverified_direct_action_count":0},"idempotency_replay":{"approved_repair_count":0,"authenticated_bound_decision_count":0,"blind_retry_count":0,"live_target_revalidation_count":0,"minimum_trials_per_cell":3,"model_call_count":0,"observed_trial_count":3,"over_halt_count":0,"policy_approved_repair_count":0,"reconciliation_required_count":0,"replay_dispatch_count":0,"retained_repair_evidence_count":0,"silent_incorrect_success_count":0,"task_condition_cell_count":1,"unplanned_intervention_count":0,"unsafe_effect_count":0,"unverified_direct_action_count":0},"safe_halt":{"approved_repair_count":0,"authenticated_bound_decision_count":0,"blind_retry_count":0,"live_target_revalidation_count":0,"minimum_trials_per_cell":3,"model_call_count":0,"observed_trial_count":3,"over_halt_count":0,"policy_approved_repair_count":0,"reconciliation_required_count":0,"replay_dispatch_count":0,"retained_repair_evidence_count":0,"silent_incorrect_success_count":0,"task_condition_cell_count":1,"unplanned_intervention_count":0,"unsafe_effect_count":0,"unverified_direct_action_count":0},"uncertain_delivery":{"approved_repair_count":0,"authenticated_bound_decision_count":0,"blind_retry_count":0,"live_target_revalidation_count":0,"minimum_trials_per_cell":3,"model_call_count":0,"observed_trial_count":3,"over_halt_count":0,"policy_approved_repair_count":0,"reconciliation_required_count":3,"replay_dispatch_count":0,"retained_repair_evidence_count":0,"silent_incorrect_success_count":0,"task_condition_cell_count":1,"unplanned_intervention_count":0,"unsafe_effect_count":0,"unverified_direct_action_count":0}},"minimum_trials_per_task_condition":3,"schema_version":"openadapt.qualification-evidence-decision-campaign-summary/v1","task_count":1},"decision_commitment_sha256":"sha256:51de0c8c068bab300d24d3dbec0026cfac1510298a40f3176afc37f4ae4249bf","decision_identity_sha256":"sha256:e7f561d1910b367755749a67181ccf67ce8df1450da30b62b8697bd5222682ed","decision_revision":1,"effect_contract_sha256":"sha256:f304b1cf9d792cc40989d6d34e557376f93d3c560c9f6dfcb46776f5d60a022e","entity_class":"record","environment_contract_sha256":"sha256:ade4a1c0e75e720d2914268a0c772f64ff64d24ff09dcab9e9f56269973542c8","evidence_authority_contract_sha256":"sha256:1aa7cfcb5f3df6b99372a28c305177e046487c8ec5b61111edbf1a12d3e76663","evidence_class":"remote-safe-synthetic","evidence_manifest_readback_sha256":"sha256:9e619a68b26ba2c7d04fc484378096559c5d4225330ec74bf7d9f8eff251a1d0","evidence_manifest_sha256":"sha256:7954e17efc14fc891d477f4924761c86c2443436ec60ab80390ed1a442efa9cd","expires_at":null,"identity_contract_sha256":"sha256:3113c56d0b48b79b142652b9d4c7777c485cafaaf621720ef18b5c405e2778fd","input_contract_sha256":"sha256:b2df58906974d44f067211cc8a586bac78b28577bcecb0448c0573b0049bac38","issued_at":"2026-09-02T19:22:47Z","issuer":{"environment":"synthetic-qualification-evidence-decision","ref":"refs/heads/main","repository":"OpenAdaptAI/.github","repository_id":"858454062","repository_owner_id":"132681217","source_commit":"78aebd3c98e66943eb3da0144945199300f16323","workflow":".github/workflows/issue-synthetic-qualification-evidence-decision.yml"},"issuer_key_id":"qa-ed25519-9cf4bca214c01d79","not_before":"2026-09-02T19:22:47Z","organization_id_sha256":"sha256:45e08e0ba4b8c9b885d84c30ae80cd84e944e51a3a9b1039c1f55c05cb948c14","policy_contract_sha256":"sha256:5c28109e98235d3301cbcd91b81ed31c9148152b6b3be720cf637451432ce9f7","revocation_state_sha256":"sha256:250ab430e467f5e584ebd2b1832976b42186b698da71d627ee1724c2b1da2457","schema_version":"openadapt.qualification-evidence-decision-receipt/v2","signature":"n+PIv19GHsu0+UBa0938o7FlsDLZuhnBSeHltffixPW5mpuDh4sBm1l1wviXu/gfAkHpV5f1Eu41gcC+m3R9Dg==","signer_registry_sha256":"sha256:e243a23243b24986ed08812e284a1bd8c4993814149f02bcba79cc520e10ca14","signing_statement":{"commitment_scheme":"sha256-canonical-json-lf","object_schema_version":"openadapt.qualification-evidence-decision-receipt/v2","schema_version":"openadapt.qualification-evidence-signing-statement/v1","signature_domain":"OpenAdapt qualification evidence decision receipt v2\u0000","unsigned_object_sha256":"sha256:199cba0360b91c1c76bea64024ab91d14a6a7c2b739ce16e57ace671bb72f5cf","unsigned_size_bytes":6106},"verdict":"ADMIT","workflow_id_sha256":"sha256:bf2695b76e1e91fc16b829109fadfc24a598938baea62c82acbd60ec4db3a465","workflow_version_id_sha256":"sha256:be4ac2f50a532623d95aa0be9003a5f0fc032890bc8af5dd8475cf9587c02b73"}
