{"action_contract_sha256":"sha256:d1f8d2eacb5f4618e826d97ca7353f2c4bc58a87dbe29d58b04b44bd469aa71f","admitted_runtime_sha256":"sha256:7bbbfd80b268b3b0569f5d3d253169bf84ca3c7d6880e65bc96466627feadab4","algorithm":"ed25519","application_contract_sha256":"sha256:994b58c84276503c0748d453b12ef0ee7678389a39da49d5b751179bd3aa9b0b","bundle_sha256":"sha256:96485be6462fbdecc00ee534788950326fad6745bec425f3b21cd4f89c64dfa5","bundle_version":"0.0.0-synthetic","campaign_artifact_sha256":"sha256:be9d5cf2b7f6f11f7e9a8bf0f03032035d9ceae2d854da9a460d13ed24c8bf16","campaign_permit_sha256":"sha256:1320210cc6e59acd78282c1a2430fc61cdc55ed2d7042df39f7e0ca64c3709b1","campaign_summary":{"classes":{"declared_attended":{"approved_repair_count":0,"authenticated_bound_decision_count":3,"blind_retry_count":0,"live_target_revalidation_count":3,"minimum_trials_per_cell":3,"model_call_count":0,"observed_trial_count":3,"over_halt_count":0,"policy_approved_repair_count":0,"reconciliation_required_count":0,"replay_dispatch_count":0,"retained_repair_evidence_count":0,"silent_incorrect_success_count":0,"task_condition_cell_count":1,"unplanned_intervention_count":0,"unsafe_effect_count":0,"unverified_direct_action_count":0},"governed_repair":{"approved_repair_count":3,"authenticated_bound_decision_count":0,"blind_retry_count":0,"live_target_revalidation_count":3,"minimum_trials_per_cell":3,"model_call_count":0,"observed_trial_count":3,"over_halt_count":0,"policy_approved_repair_count":3,"reconciliation_required_count":0,"replay_dispatch_count":0,"retained_repair_evidence_count":3,"silent_incorrect_success_count":0,"task_condition_cell_count":1,"unplanned_intervention_count":0,"unsafe_effect_count":0,"unverified_direct_action_count":0},"healthy":{"approved_repair_count":0,"authenticated_bound_decision_count":0,"blind_retry_count":0,"live_target_revalidation_count":0,"minimum_trials_per_cell":3,"model_call_count":0,"observed_trial_count":3,"over_halt_count":0,"policy_approved_repair_count":0,"reconciliation_required_count":0,"replay_dispatch_count":0,"retained_repair_evidence_count":0,"silent_incorrect_success_count":0,"task_condition_cell_count":1,"unplanned_intervention_count":0,"unsafe_effect_count":0,"unverified_direct_action_count":0},"idempotency_replay":{"approved_repair_count":0,"authenticated_bound_decision_count":0,"blind_retry_count":0,"live_target_revalidation_count":0,"minimum_trials_per_cell":3,"model_call_count":0,"observed_trial_count":3,"over_halt_count":0,"policy_approved_repair_count":0,"reconciliation_required_count":0,"replay_dispatch_count":0,"retained_repair_evidence_count":0,"silent_incorrect_success_count":0,"task_condition_cell_count":1,"unplanned_intervention_count":0,"unsafe_effect_count":0,"unverified_direct_action_count":0},"safe_halt":{"approved_repair_count":0,"authenticated_bound_decision_count":0,"blind_retry_count":0,"live_target_revalidation_count":0,"minimum_trials_per_cell":3,"model_call_count":0,"observed_trial_count":3,"over_halt_count":0,"policy_approved_repair_count":0,"reconciliation_required_count":0,"replay_dispatch_count":0,"retained_repair_evidence_count":0,"silent_incorrect_success_count":0,"task_condition_cell_count":1,"unplanned_intervention_count":0,"unsafe_effect_count":0,"unverified_direct_action_count":0},"uncertain_delivery":{"approved_repair_count":0,"authenticated_bound_decision_count":0,"blind_retry_count":0,"live_target_revalidation_count":0,"minimum_trials_per_cell":3,"model_call_count":0,"observed_trial_count":3,"over_halt_count":0,"policy_approved_repair_count":0,"reconciliation_required_count":3,"replay_dispatch_count":0,"retained_repair_evidence_count":0,"silent_incorrect_success_count":0,"task_condition_cell_count":1,"unplanned_intervention_count":0,"unsafe_effect_count":0,"unverified_direct_action_count":0}},"minimum_trials_per_task_condition":3,"schema_version":"openadapt.qualification-evidence-decision-campaign-summary/v1","task_count":1},"decision_commitment_sha256":"sha256:26ef3667dff2e4e59d254ddded3282605a0a65bde49147369b8023029786ecd4","decision_identity_sha256":"sha256:211e5d8dd16affce84bf33fb4130ed05e5571de584fbf1462a3a65d453c193ff","decision_revision":1,"effect_contract_sha256":"sha256:6f77bbaddad842602fda0fd016ef840ced8a4b29202899a547b552507f08c209","entity_class":"record","environment_contract_sha256":"sha256:e493e3392c9e208f6002cc64e3115e9320aa8b21ef31d422f236c056211add98","evidence_authority_contract_sha256":"sha256:1aa7cfcb5f3df6b99372a28c305177e046487c8ec5b61111edbf1a12d3e76663","evidence_class":"remote-safe-synthetic","evidence_manifest_readback_sha256":"sha256:34662d3fc4357431fcc4caadacffa8e1c3febf3763d1eb59857be50d7a92926d","evidence_manifest_sha256":"sha256:b1bae363a49b3b81d3b815ceb973465e79e8234b2e57c99bd2293b4b8c09c370","expires_at":null,"identity_contract_sha256":"sha256:5a96e6bee75bd002052f6f20647d53ad6a5587f5dd982d740dbcc41eaf766dfe","input_contract_sha256":"sha256:525ee8fa4377e825261666089c497267d1bdc2012ba4c981621317594ab13370","issued_at":"2026-09-02T19:22:47Z","issuer":{"environment":"synthetic-qualification-evidence-decision","ref":"refs/heads/main","repository":"OpenAdaptAI/.github","repository_id":"858454062","repository_owner_id":"132681217","source_commit":"78aebd3c98e66943eb3da0144945199300f16323","workflow":".github/workflows/issue-synthetic-qualification-evidence-decision.yml"},"issuer_key_id":"qa-ed25519-9cf4bca214c01d79","not_before":"2026-09-02T19:22:47Z","organization_id_sha256":"sha256:2ab3ac990449e25aa93b4cc0e76e8b13549b5dda54d46f96c87991a8112b4f78","policy_contract_sha256":"sha256:1e189edfda30d7a4d8974668824619387b55b022aeaff6b59dfdf7592d445618","revocation_state_sha256":"sha256:250ab430e467f5e584ebd2b1832976b42186b698da71d627ee1724c2b1da2457","schema_version":"openadapt.qualification-evidence-decision-receipt/v2","signature":"RRqoOk25tt/zVMJ5wOwmAn3AWBcGYwCAgpmLQSJtB5G4O1ecCAOq0OxHeMpjZ6PBLcmrpCk6AnR19+HZICWpDA==","signer_registry_sha256":"sha256:e243a23243b24986ed08812e284a1bd8c4993814149f02bcba79cc520e10ca14","signing_statement":{"commitment_scheme":"sha256-canonical-json-lf","object_schema_version":"openadapt.qualification-evidence-decision-receipt/v2","schema_version":"openadapt.qualification-evidence-signing-statement/v1","signature_domain":"OpenAdapt qualification evidence decision receipt v2\u0000","unsigned_object_sha256":"sha256:10fbd41f483e8fa26f91d1afb5ce1217e2112084cd98d41f7c8fd48fbd7b6b46","unsigned_size_bytes":6106},"verdict":"ADMIT","workflow_id_sha256":"sha256:9b3d02011dd59767d2dcfcffa1e4413165642569c7879c80a99cfcef90a3a50c","workflow_version_id_sha256":"sha256:25746f2b171f060d6dd8173b8eaa3170818867c675c38bbfce2d2ecd0705f272"}
