{"action_contract_sha256":"sha256:b6f6061ee416cc6eb93a92c653fd081696aa8deb3d2d23b3d18df78c61c86010","admitted_runtime_sha256":"sha256:06e608a934deef56c93ee1ca8de511d6daba08459626e8245bd0db4c391e64e9","algorithm":"ed25519","application_contract_sha256":"sha256:c7a92eaab38cef296bf8482a7a76b88dbceb6b0c03b50070756783c13d238083","bundle_sha256":"sha256:8f390a7450a3b617608da209400cb555d3bfdaaafa6bd539faa69c00044aab24","bundle_version":"0.0.0-synthetic","campaign_artifact_sha256":"sha256:d6bad0a82b99155a4dc40cebd878c0e7702174ba104dedbd1fe22760ae810ea8","campaign_permit_sha256":"sha256:a257543af2704bc22ebd2efa0d34621c55f4df52a5c8df1ec287e865217b3720","campaign_summary":{"classes":{"declared_attended":{"approved_repair_count":0,"authenticated_bound_decision_count":3,"blind_retry_count":0,"live_target_revalidation_count":3,"minimum_trials_per_cell":3,"model_call_count":0,"observed_trial_count":3,"over_halt_count":0,"policy_approved_repair_count":0,"reconciliation_required_count":0,"replay_dispatch_count":0,"retained_repair_evidence_count":0,"silent_incorrect_success_count":0,"task_condition_cell_count":1,"unplanned_intervention_count":0,"unsafe_effect_count":0,"unverified_direct_action_count":0},"governed_repair":{"approved_repair_count":3,"authenticated_bound_decision_count":0,"blind_retry_count":0,"live_target_revalidation_count":3,"minimum_trials_per_cell":3,"model_call_count":0,"observed_trial_count":3,"over_halt_count":0,"policy_approved_repair_count":3,"reconciliation_required_count":0,"replay_dispatch_count":0,"retained_repair_evidence_count":3,"silent_incorrect_success_count":0,"task_condition_cell_count":1,"unplanned_intervention_count":0,"unsafe_effect_count":0,"unverified_direct_action_count":0},"healthy":{"approved_repair_count":0,"authenticated_bound_decision_count":0,"blind_retry_count":0,"live_target_revalidation_count":0,"minimum_trials_per_cell":3,"model_call_count":0,"observed_trial_count":3,"over_halt_count":0,"policy_approved_repair_count":0,"reconciliation_required_count":0,"replay_dispatch_count":0,"retained_repair_evidence_count":0,"silent_incorrect_success_count":0,"task_condition_cell_count":1,"unplanned_intervention_count":0,"unsafe_effect_count":0,"unverified_direct_action_count":0},"idempotency_replay":{"approved_repair_count":0,"authenticated_bound_decision_count":0,"blind_retry_count":0,"live_target_revalidation_count":0,"minimum_trials_per_cell":3,"model_call_count":0,"observed_trial_count":3,"over_halt_count":0,"policy_approved_repair_count":0,"reconciliation_required_count":0,"replay_dispatch_count":0,"retained_repair_evidence_count":0,"silent_incorrect_success_count":0,"task_condition_cell_count":1,"unplanned_intervention_count":0,"unsafe_effect_count":0,"unverified_direct_action_count":0},"safe_halt":{"approved_repair_count":0,"authenticated_bound_decision_count":0,"blind_retry_count":0,"live_target_revalidation_count":0,"minimum_trials_per_cell":3,"model_call_count":0,"observed_trial_count":3,"over_halt_count":0,"policy_approved_repair_count":0,"reconciliation_required_count":0,"replay_dispatch_count":0,"retained_repair_evidence_count":0,"silent_incorrect_success_count":0,"task_condition_cell_count":1,"unplanned_intervention_count":0,"unsafe_effect_count":0,"unverified_direct_action_count":0},"uncertain_delivery":{"approved_repair_count":0,"authenticated_bound_decision_count":0,"blind_retry_count":0,"live_target_revalidation_count":0,"minimum_trials_per_cell":3,"model_call_count":0,"observed_trial_count":3,"over_halt_count":0,"policy_approved_repair_count":0,"reconciliation_required_count":3,"replay_dispatch_count":0,"retained_repair_evidence_count":0,"silent_incorrect_success_count":0,"task_condition_cell_count":1,"unplanned_intervention_count":0,"unsafe_effect_count":0,"unverified_direct_action_count":0}},"minimum_trials_per_task_condition":3,"schema_version":"openadapt.qualification-evidence-decision-campaign-summary/v1","task_count":1},"decision_commitment_sha256":"sha256:0aef06fc378215b2daf4dca6b230dcd78b066455d34544c91913700d1641b71f","decision_identity_sha256":"sha256:1eba94d575ecde769026913f76c1e5476767426f896efe0f21dd273b37bed338","decision_revision":1,"effect_contract_sha256":"sha256:f1491b3d64901b376a8e12386761fea936a66ee617ef9c3cff2baec2c677cb1c","entity_class":"record","environment_contract_sha256":"sha256:7bd7524d88439475e946ee691ff2e96588b7cf9f1c5c20eaf5294ef3ba1f8007","evidence_authority_contract_sha256":"sha256:1aa7cfcb5f3df6b99372a28c305177e046487c8ec5b61111edbf1a12d3e76663","evidence_class":"remote-safe-synthetic","evidence_manifest_readback_sha256":"sha256:993ad6548f53bda068b052dabb54b25f174a32c4f9bddeb5887d36404d9715e7","evidence_manifest_sha256":"sha256:bf523c2afa3aa0f2682daf5e35720162c0d42b3eed92ef7022ccacd2128b0470","expires_at":null,"identity_contract_sha256":"sha256:f52e6ae6e172a637efccf2df8eeea268b91407fc032d70b9bf144b8a88069479","input_contract_sha256":"sha256:20d071ff8df536664616750e1147f2bc49bd12762e39ebf2f37bf17550bf77cf","issued_at":"2026-09-02T19:22:47Z","issuer":{"environment":"synthetic-qualification-evidence-decision","ref":"refs/heads/main","repository":"OpenAdaptAI/.github","repository_id":"858454062","repository_owner_id":"132681217","source_commit":"78aebd3c98e66943eb3da0144945199300f16323","workflow":".github/workflows/issue-synthetic-qualification-evidence-decision.yml"},"issuer_key_id":"qa-ed25519-9cf4bca214c01d79","not_before":"2026-09-02T19:22:47Z","organization_id_sha256":"sha256:09c1e6d22cff96555823460d10971421c7a5604918323d0d2c6ae5633fd370d1","policy_contract_sha256":"sha256:161c7e99ad336b6b60895d3b46b362d591507add7388adb0ffc2193d6f96690d","revocation_state_sha256":"sha256:250ab430e467f5e584ebd2b1832976b42186b698da71d627ee1724c2b1da2457","schema_version":"openadapt.qualification-evidence-decision-receipt/v2","signature":"3Zfa+rx+yYmzsm6qROU4JK0fqm++lYM/lTER6dPRQXLEHju+tA0jm4QNCD76PE0jW2d00W3hi0DatEeHahcRCQ==","signer_registry_sha256":"sha256:e243a23243b24986ed08812e284a1bd8c4993814149f02bcba79cc520e10ca14","signing_statement":{"commitment_scheme":"sha256-canonical-json-lf","object_schema_version":"openadapt.qualification-evidence-decision-receipt/v2","schema_version":"openadapt.qualification-evidence-signing-statement/v1","signature_domain":"OpenAdapt qualification evidence decision receipt v2\u0000","unsigned_object_sha256":"sha256:b5c50b36ef2500d0ec3d15e68efd25a2fe84b5e360d37055d4e3bfbfd8c647cb","unsigned_size_bytes":6106},"verdict":"ADMIT","workflow_id_sha256":"sha256:d410e2e0badc350f44707aac47e8e97c49d6fb5e234b15276c6927e2747d0f63","workflow_version_id_sha256":"sha256:dec6e06d70d68a669574ac1a4b0cf142e496021382a6d1415bdc8bc7ebdf324b"}
