{"action_contract_sha256":"sha256:7b18bb8526651f15cea5874c0e3d9113ae2af2690bddcde276ee0cdd8f71b956","admitted_runtime_sha256":"sha256:371693e7607d1cdc1ea360ef5d657c1af791a0af39677fa2ce5933e7ba712719","algorithm":"ed25519","application_contract_sha256":"sha256:66bc4dfbb908e8dc5012286235fa9ef94c0db284d5b38182c630d26fd550d4fe","bundle_sha256":"sha256:2c90a95f6bab13a45ff0ea5afb3190c934569410e6905a2f0d27dbcad9bdff48","bundle_version":"0.0.0-synthetic","campaign_artifact_sha256":"sha256:3bea5704781a49f6e1e137ad9a0f77fe7eb93aa5ff517d7ddaaa2e281d194d4f","campaign_permit_sha256":"sha256:4d11ff6345bda70bb4d4c0727b1ebe9e71d8a837bff002bd3dd4fdfd44a2b5bb","campaign_summary":{"classes":{"declared_attended":{"approved_repair_count":0,"authenticated_bound_decision_count":3,"blind_retry_count":0,"live_target_revalidation_count":3,"minimum_trials_per_cell":3,"model_call_count":0,"observed_trial_count":3,"over_halt_count":0,"policy_approved_repair_count":0,"reconciliation_required_count":0,"replay_dispatch_count":0,"retained_repair_evidence_count":0,"silent_incorrect_success_count":0,"task_condition_cell_count":1,"unplanned_intervention_count":0,"unsafe_effect_count":0,"unverified_direct_action_count":0},"governed_repair":{"approved_repair_count":3,"authenticated_bound_decision_count":0,"blind_retry_count":0,"live_target_revalidation_count":3,"minimum_trials_per_cell":3,"model_call_count":0,"observed_trial_count":3,"over_halt_count":0,"policy_approved_repair_count":3,"reconciliation_required_count":0,"replay_dispatch_count":0,"retained_repair_evidence_count":3,"silent_incorrect_success_count":0,"task_condition_cell_count":1,"unplanned_intervention_count":0,"unsafe_effect_count":0,"unverified_direct_action_count":0},"healthy":{"approved_repair_count":0,"authenticated_bound_decision_count":0,"blind_retry_count":0,"live_target_revalidation_count":0,"minimum_trials_per_cell":3,"model_call_count":0,"observed_trial_count":3,"over_halt_count":0,"policy_approved_repair_count":0,"reconciliation_required_count":0,"replay_dispatch_count":0,"retained_repair_evidence_count":0,"silent_incorrect_success_count":0,"task_condition_cell_count":1,"unplanned_intervention_count":0,"unsafe_effect_count":0,"unverified_direct_action_count":0},"idempotency_replay":{"approved_repair_count":0,"authenticated_bound_decision_count":0,"blind_retry_count":0,"live_target_revalidation_count":0,"minimum_trials_per_cell":3,"model_call_count":0,"observed_trial_count":3,"over_halt_count":0,"policy_approved_repair_count":0,"reconciliation_required_count":0,"replay_dispatch_count":0,"retained_repair_evidence_count":0,"silent_incorrect_success_count":0,"task_condition_cell_count":1,"unplanned_intervention_count":0,"unsafe_effect_count":0,"unverified_direct_action_count":0},"safe_halt":{"approved_repair_count":0,"authenticated_bound_decision_count":0,"blind_retry_count":0,"live_target_revalidation_count":0,"minimum_trials_per_cell":3,"model_call_count":0,"observed_trial_count":3,"over_halt_count":0,"policy_approved_repair_count":0,"reconciliation_required_count":0,"replay_dispatch_count":0,"retained_repair_evidence_count":0,"silent_incorrect_success_count":0,"task_condition_cell_count":1,"unplanned_intervention_count":0,"unsafe_effect_count":0,"unverified_direct_action_count":0},"uncertain_delivery":{"approved_repair_count":0,"authenticated_bound_decision_count":0,"blind_retry_count":0,"live_target_revalidation_count":0,"minimum_trials_per_cell":3,"model_call_count":0,"observed_trial_count":3,"over_halt_count":0,"policy_approved_repair_count":0,"reconciliation_required_count":3,"replay_dispatch_count":0,"retained_repair_evidence_count":0,"silent_incorrect_success_count":0,"task_condition_cell_count":1,"unplanned_intervention_count":0,"unsafe_effect_count":0,"unverified_direct_action_count":0}},"minimum_trials_per_task_condition":3,"schema_version":"openadapt.qualification-evidence-decision-campaign-summary/v1","task_count":1},"decision_commitment_sha256":"sha256:8f6e7f0afc59d939ca7852e9075aa1cbe35ca36ddf83c2404403b64ac2eb3057","decision_identity_sha256":"sha256:2981e88fa740fbd1af87138510434e8aaa924f9fe1f235392132ce3c11ae8fd8","decision_revision":1,"effect_contract_sha256":"sha256:03e82d7fcb0c0a1be7020f22e7019be951afbcac294c20f1c8ad0833fb4a85bc","entity_class":"record","environment_contract_sha256":"sha256:3b3c78af457af2255d26cd96b89ba693ed1c85548120c666bc5fc503b78d1263","evidence_authority_contract_sha256":"sha256:1aa7cfcb5f3df6b99372a28c305177e046487c8ec5b61111edbf1a12d3e76663","evidence_class":"remote-safe-synthetic","evidence_manifest_readback_sha256":"sha256:028b5be2e434bc9333308887ebd9affd3fe137d626be51c2e5c4d05a4179c45f","evidence_manifest_sha256":"sha256:fcbc0b7777a9601b2f35604181c0ad7bc221d7219a82c106aae195b675a93563","expires_at":null,"identity_contract_sha256":"sha256:accdf3bbab7958450c0a13a44cbcbd66df732309907c95381f0c1075e73fa624","input_contract_sha256":"sha256:5bd3a254f89a84d942c2a003e6977af6a88064c74531e572b23ab4efeb3bbc53","issued_at":"2026-09-02T19:22:47Z","issuer":{"environment":"synthetic-qualification-evidence-decision","ref":"refs/heads/main","repository":"OpenAdaptAI/.github","repository_id":"858454062","repository_owner_id":"132681217","source_commit":"78aebd3c98e66943eb3da0144945199300f16323","workflow":".github/workflows/issue-synthetic-qualification-evidence-decision.yml"},"issuer_key_id":"qa-ed25519-9cf4bca214c01d79","not_before":"2026-09-02T19:22:47Z","organization_id_sha256":"sha256:8d61102344335ae5a0cf4404b65af221551289ef9c4828490ec1cd2974bf2f25","policy_contract_sha256":"sha256:ebd2bd4e6ab27235b7363dda60e7a6b944079567195ba0f979779e18e01e5ebe","revocation_state_sha256":"sha256:250ab430e467f5e584ebd2b1832976b42186b698da71d627ee1724c2b1da2457","schema_version":"openadapt.qualification-evidence-decision-receipt/v2","signature":"xeVEsInIHSwCS/LVhQq7NcCvicNQ0oem6Y15Ay9Rn8ZebXYKzBvjlAwXc4qd97fzjhOJt7lqgnYuqXIN/fUPDQ==","signer_registry_sha256":"sha256:e243a23243b24986ed08812e284a1bd8c4993814149f02bcba79cc520e10ca14","signing_statement":{"commitment_scheme":"sha256-canonical-json-lf","object_schema_version":"openadapt.qualification-evidence-decision-receipt/v2","schema_version":"openadapt.qualification-evidence-signing-statement/v1","signature_domain":"OpenAdapt qualification evidence decision receipt v2\u0000","unsigned_object_sha256":"sha256:17ef6edf9582c5f1ffea0ebda736dcb6577634e7de5a4dfaae8f65f1f9ac37df","unsigned_size_bytes":6106},"verdict":"ADMIT","workflow_id_sha256":"sha256:797e194b3613587d0e801fdf7ebeff35f007fc5476bc90363e57f4b53608c878","workflow_version_id_sha256":"sha256:437094a747c7a4af7ecedc2d4e8f0bd12c526d5746c0db875fb3a673b4573bfb"}
