{"action_contract_sha256":"sha256:d4b8a931c16bca24cd343c786f41566357d9edcc8b0b97d3c1cb9907571dd56b","admitted_runtime_sha256":"sha256:56d32818989cb3a92830080ead39e10b08718c55e00988117f22cbfeaac98854","algorithm":"ed25519","application_contract_sha256":"sha256:e8f70b24976d2befeaea5e54059e39b1934a211c49cba65ac41e6cfdfd70ec80","bundle_sha256":"sha256:33f8c637f3d5d9eb23b92e0fb7ba74d2713a52f7c8ed11495b30f8bbefb1f312","bundle_version":"0.0.0-synthetic","campaign_artifact_sha256":"sha256:e2f2aa6b30118864682892a08e7e151039a34e7e7f84ff027e253cf8daddff78","campaign_permit_sha256":"sha256:da4af1f21aa121a00f92d88fc129d47bbd1a027462408e6bf2adf8fe66fe4255","campaign_summary":{"classes":{"declared_attended":{"approved_repair_count":0,"authenticated_bound_decision_count":3,"blind_retry_count":0,"live_target_revalidation_count":3,"minimum_trials_per_cell":3,"model_call_count":0,"observed_trial_count":3,"over_halt_count":0,"policy_approved_repair_count":0,"reconciliation_required_count":0,"replay_dispatch_count":0,"retained_repair_evidence_count":0,"silent_incorrect_success_count":0,"task_condition_cell_count":1,"unplanned_intervention_count":0,"unsafe_effect_count":0,"unverified_direct_action_count":0},"governed_repair":{"approved_repair_count":3,"authenticated_bound_decision_count":0,"blind_retry_count":0,"live_target_revalidation_count":3,"minimum_trials_per_cell":3,"model_call_count":0,"observed_trial_count":3,"over_halt_count":0,"policy_approved_repair_count":3,"reconciliation_required_count":0,"replay_dispatch_count":0,"retained_repair_evidence_count":3,"silent_incorrect_success_count":0,"task_condition_cell_count":1,"unplanned_intervention_count":0,"unsafe_effect_count":0,"unverified_direct_action_count":0},"healthy":{"approved_repair_count":0,"authenticated_bound_decision_count":0,"blind_retry_count":0,"live_target_revalidation_count":0,"minimum_trials_per_cell":3,"model_call_count":0,"observed_trial_count":3,"over_halt_count":0,"policy_approved_repair_count":0,"reconciliation_required_count":0,"replay_dispatch_count":0,"retained_repair_evidence_count":0,"silent_incorrect_success_count":0,"task_condition_cell_count":1,"unplanned_intervention_count":0,"unsafe_effect_count":0,"unverified_direct_action_count":0},"idempotency_replay":{"approved_repair_count":0,"authenticated_bound_decision_count":0,"blind_retry_count":0,"live_target_revalidation_count":0,"minimum_trials_per_cell":3,"model_call_count":0,"observed_trial_count":3,"over_halt_count":0,"policy_approved_repair_count":0,"reconciliation_required_count":0,"replay_dispatch_count":0,"retained_repair_evidence_count":0,"silent_incorrect_success_count":0,"task_condition_cell_count":1,"unplanned_intervention_count":0,"unsafe_effect_count":0,"unverified_direct_action_count":0},"safe_halt":{"approved_repair_count":0,"authenticated_bound_decision_count":0,"blind_retry_count":0,"live_target_revalidation_count":0,"minimum_trials_per_cell":3,"model_call_count":0,"observed_trial_count":3,"over_halt_count":0,"policy_approved_repair_count":0,"reconciliation_required_count":0,"replay_dispatch_count":0,"retained_repair_evidence_count":0,"silent_incorrect_success_count":0,"task_condition_cell_count":1,"unplanned_intervention_count":0,"unsafe_effect_count":0,"unverified_direct_action_count":0},"uncertain_delivery":{"approved_repair_count":0,"authenticated_bound_decision_count":0,"blind_retry_count":0,"live_target_revalidation_count":0,"minimum_trials_per_cell":3,"model_call_count":0,"observed_trial_count":3,"over_halt_count":0,"policy_approved_repair_count":0,"reconciliation_required_count":3,"replay_dispatch_count":0,"retained_repair_evidence_count":0,"silent_incorrect_success_count":0,"task_condition_cell_count":1,"unplanned_intervention_count":0,"unsafe_effect_count":0,"unverified_direct_action_count":0}},"minimum_trials_per_task_condition":3,"schema_version":"openadapt.qualification-evidence-decision-campaign-summary/v1","task_count":1},"decision_commitment_sha256":"sha256:e0491959b45066087d85ff35d32c6430b2f8d54f3f23750e01ac8cb7d48248f4","decision_identity_sha256":"sha256:26306ae89024e3be08e8151ef3be5c568d5f7b8b9afc7f11ad89af44a9260d36","decision_revision":1,"effect_contract_sha256":"sha256:ce11f9ac1059d29c5648a662ce8a4e8528ea3e8d844657aec8422d8b125a0698","entity_class":"record","environment_contract_sha256":"sha256:b01e155a3704b1f781937585da7f86c47adb8c86d48f032019ef41d6e9ceea57","evidence_authority_contract_sha256":"sha256:1aa7cfcb5f3df6b99372a28c305177e046487c8ec5b61111edbf1a12d3e76663","evidence_class":"remote-safe-synthetic","evidence_manifest_readback_sha256":"sha256:b0e022dba06f368a25c2f5e9a7dfbe92aece9125cb791c349b6981d056b8bf19","evidence_manifest_sha256":"sha256:3edc7613e1decd5714c8011854fb27d5d431bb085f5e47d6243926285d502bee","expires_at":"2026-09-09T17:59:26Z","identity_contract_sha256":"sha256:34b008dd040d718fdc4d7b85b9311749b9865f47b4ba43bf6cd4a140bcf36c65","input_contract_sha256":"sha256:a82ba67af90f81e9a09f2db445a57f812b40a04c876396f191eb77eb53487a0f","issued_at":"2026-09-02T17:59:26Z","issuer":{"environment":"synthetic-qualification-evidence-decision","ref":"refs/heads/main","repository":"OpenAdaptAI/.github","repository_id":"858454062","repository_owner_id":"132681217","source_commit":"d8a2d5d76344e36dd51504166dc751d9c3091b74","workflow":".github/workflows/issue-synthetic-qualification-evidence-decision.yml"},"issuer_key_id":"qa-ed25519-9cf4bca214c01d79","not_before":"2026-09-02T17:59:26Z","organization_id_sha256":"sha256:fcba879d867709da525f7f994a2642bc7a32014e324523a9d276bec54c3d296b","policy_contract_sha256":"sha256:482e3c7f10d044086283ea387f22b21c011e6c00cfc7fbf14cf82cfe2aedd1e0","revocation_state_sha256":"sha256:36fa86bae55a9a5577c5f173ab1efcb3f66a8c24a0b2a3e5efad6f5bbc5aa78e","schema_version":"openadapt.qualification-evidence-decision-receipt/v2","signature":"UoGN0pObphL0pW7WoWQWmfzMpSLiVSSMDCX0YQd+jxDyNodoNA/mXuIeOB+JWJZdaARdm7+67xy3UdqoeC+iCw==","signer_registry_sha256":"sha256:728e0d4f7c2a85a256ae3bf95a3ed56708daf818252c2b19525efc61e81ca1bc","signing_statement":{"commitment_scheme":"sha256-canonical-json-lf","object_schema_version":"openadapt.qualification-evidence-decision-receipt/v2","schema_version":"openadapt.qualification-evidence-signing-statement/v1","signature_domain":"OpenAdapt qualification evidence decision receipt v2\u0000","unsigned_object_sha256":"sha256:b661e6614524efa9a3fd05346057fdf32a3006440a73191dfffba6f1cd44efe3","unsigned_size_bytes":6124},"verdict":"ADMIT","workflow_id_sha256":"sha256:7176583f6120b7ff016363644afc47e835b2e4b438abe4050df160570f780af1","workflow_version_id_sha256":"sha256:4acf27da1f384b7967a1bb4fb463570657894cb83468e5763940d69ab9df1386"}
