{"action_contract_sha256":"sha256:74a29625d03c29b7282704464f8621ec12673969654a876148a8b8763ebf9ceb","admitted_runtime_sha256":"sha256:550fffe50990fa8431d332bdd5fe4755976d83baa7ad62553f50ad9e4ddcd1ae","algorithm":"ed25519","application_contract_sha256":"sha256:316ef25fabfe2f59b38acd6fd3a0907e82a45ba54d8ba93dd6146a713b99c72f","bundle_sha256":"sha256:2e31de4ce7e335718d8053b6ecadf9e78ba3271cdc69b545833fdf066686153c","bundle_version":"0.0.0-synthetic","campaign_artifact_sha256":"sha256:4bb1c7bc877b9479dd960513a29e6b093425c110c7fb22aad433811118794247","campaign_permit_sha256":"sha256:9e7a25ce1832b517596adf525bf0ca5f7a57c2ff6d037646d61bb16c463f4f07","campaign_summary":{"classes":{"declared_attended":{"approved_repair_count":0,"authenticated_bound_decision_count":3,"blind_retry_count":0,"live_target_revalidation_count":3,"minimum_trials_per_cell":3,"model_call_count":0,"observed_trial_count":3,"over_halt_count":0,"policy_approved_repair_count":0,"reconciliation_required_count":0,"replay_dispatch_count":0,"retained_repair_evidence_count":0,"silent_incorrect_success_count":0,"task_condition_cell_count":1,"unplanned_intervention_count":0,"unsafe_effect_count":0,"unverified_direct_action_count":0},"governed_repair":{"approved_repair_count":3,"authenticated_bound_decision_count":0,"blind_retry_count":0,"live_target_revalidation_count":3,"minimum_trials_per_cell":3,"model_call_count":0,"observed_trial_count":3,"over_halt_count":0,"policy_approved_repair_count":3,"reconciliation_required_count":0,"replay_dispatch_count":0,"retained_repair_evidence_count":3,"silent_incorrect_success_count":0,"task_condition_cell_count":1,"unplanned_intervention_count":0,"unsafe_effect_count":0,"unverified_direct_action_count":0},"healthy":{"approved_repair_count":0,"authenticated_bound_decision_count":0,"blind_retry_count":0,"live_target_revalidation_count":0,"minimum_trials_per_cell":3,"model_call_count":0,"observed_trial_count":3,"over_halt_count":0,"policy_approved_repair_count":0,"reconciliation_required_count":0,"replay_dispatch_count":0,"retained_repair_evidence_count":0,"silent_incorrect_success_count":0,"task_condition_cell_count":1,"unplanned_intervention_count":0,"unsafe_effect_count":0,"unverified_direct_action_count":0},"idempotency_replay":{"approved_repair_count":0,"authenticated_bound_decision_count":0,"blind_retry_count":0,"live_target_revalidation_count":0,"minimum_trials_per_cell":3,"model_call_count":0,"observed_trial_count":3,"over_halt_count":0,"policy_approved_repair_count":0,"reconciliation_required_count":0,"replay_dispatch_count":0,"retained_repair_evidence_count":0,"silent_incorrect_success_count":0,"task_condition_cell_count":1,"unplanned_intervention_count":0,"unsafe_effect_count":0,"unverified_direct_action_count":0},"safe_halt":{"approved_repair_count":0,"authenticated_bound_decision_count":0,"blind_retry_count":0,"live_target_revalidation_count":0,"minimum_trials_per_cell":3,"model_call_count":0,"observed_trial_count":3,"over_halt_count":0,"policy_approved_repair_count":0,"reconciliation_required_count":0,"replay_dispatch_count":0,"retained_repair_evidence_count":0,"silent_incorrect_success_count":0,"task_condition_cell_count":1,"unplanned_intervention_count":0,"unsafe_effect_count":0,"unverified_direct_action_count":0},"uncertain_delivery":{"approved_repair_count":0,"authenticated_bound_decision_count":0,"blind_retry_count":0,"live_target_revalidation_count":0,"minimum_trials_per_cell":3,"model_call_count":0,"observed_trial_count":3,"over_halt_count":0,"policy_approved_repair_count":0,"reconciliation_required_count":3,"replay_dispatch_count":0,"retained_repair_evidence_count":0,"silent_incorrect_success_count":0,"task_condition_cell_count":1,"unplanned_intervention_count":0,"unsafe_effect_count":0,"unverified_direct_action_count":0}},"minimum_trials_per_task_condition":3,"schema_version":"openadapt.qualification-evidence-decision-campaign-summary/v1","task_count":1},"decision_commitment_sha256":"sha256:8457c297473802fb62bd533ec6257bc47255a43b85b6a2bb6ab55d26a753e39f","decision_identity_sha256":"sha256:b6d8110948c316087154a8fb964945cc0fa46949be77cb4b3d573236df0e6cfa","decision_revision":1,"effect_contract_sha256":"sha256:487fc958a3d517fe78955d0a86cb7397a681f1b0a7592a6dfd164ce61762da15","entity_class":"record","environment_contract_sha256":"sha256:fbeac859c28e6f2e8274d1ec80593620106f616ca7d54356e989361300feeb9c","evidence_authority_contract_sha256":"sha256:1aa7cfcb5f3df6b99372a28c305177e046487c8ec5b61111edbf1a12d3e76663","evidence_class":"remote-safe-synthetic","evidence_manifest_readback_sha256":"sha256:b74304ef772c7d8397d6abe74b6c606f327dc8f0fae40005651b4646ffa9e8f1","evidence_manifest_sha256":"sha256:af67861167fd9707e6dfb7ccf2e2edcf0828095af8d32ffdda9518e7accb7e26","expires_at":null,"identity_contract_sha256":"sha256:34329c2f9fb7c6177d8f6731b37c3a8591485a233d2aa6c623e395f6b949a1b0","input_contract_sha256":"sha256:bf82116d12b07de906dc7b1651668330e2057251c8fe2a800c4c33d2468cce48","issued_at":"2026-09-02T19:22:47Z","issuer":{"environment":"synthetic-qualification-evidence-decision","ref":"refs/heads/main","repository":"OpenAdaptAI/.github","repository_id":"858454062","repository_owner_id":"132681217","source_commit":"78aebd3c98e66943eb3da0144945199300f16323","workflow":".github/workflows/issue-synthetic-qualification-evidence-decision.yml"},"issuer_key_id":"qa-ed25519-9cf4bca214c01d79","not_before":"2026-09-02T19:22:47Z","organization_id_sha256":"sha256:62bdc2a78c62bed5392963cb2e3a64792d4caaa614fb4e83a992ef48dd290d4d","policy_contract_sha256":"sha256:43a6a3feeea3c50fd103dfdfc81c175894fbeae31fcb52f267924f20812fac27","revocation_state_sha256":"sha256:250ab430e467f5e584ebd2b1832976b42186b698da71d627ee1724c2b1da2457","schema_version":"openadapt.qualification-evidence-decision-receipt/v2","signature":"ZNP/4ZPm8+VO3RIXUYIlGAl+0e2xGwLJaIkLGyzASR2/RGIkBXGNdWVtJmpi4NNiVvoVLjJNFbA16lAPHraeDA==","signer_registry_sha256":"sha256:e243a23243b24986ed08812e284a1bd8c4993814149f02bcba79cc520e10ca14","signing_statement":{"commitment_scheme":"sha256-canonical-json-lf","object_schema_version":"openadapt.qualification-evidence-decision-receipt/v2","schema_version":"openadapt.qualification-evidence-signing-statement/v1","signature_domain":"OpenAdapt qualification evidence decision receipt v2\u0000","unsigned_object_sha256":"sha256:1a6201b17179003c38623dc0d6fccbcdf33e2252d7d83384150d11c2e99fbace","unsigned_size_bytes":6106},"verdict":"ADMIT","workflow_id_sha256":"sha256:af41c4c921556814e1f3636b367c98910eb697aa0101738b0465e6f83163d9c5","workflow_version_id_sha256":"sha256:c5d7f28aa77745f59f867eadb92b92a0f00237cdd0bf75670ce143edde0c5a4d"}
